345575,ОБРАЗ ХУДОЖНИКА,2018-11-15,Научно популярный фильм,Научно-популярный,Кино,Цветной,1.0,117.0,DVD,"ООО ""СИНЕФОГ""",Россия,2018,"Д.Колонтай, И.Качалин, Д.Глазовский",М.Дурманов,Д.Колонтай,Д.Глазовский,Д.Глазовский,И.Качалин,12+
345576,Учитель,2018-10-17,Упорство и воля помогают герою изменить свою жизнь и жизнь сельской школы.,Художественный,Кино,Цветной,0.0,7.0,HDD,"ООО ""ТаББаК""",Россия,2018,Т.Бекмамбетов,А.Козлова,"Т.Бекмамбетов, И.Петухов",Ю.Коробейников,,Т.Бекмамбетов,6+
345577,Простопес,2018-10-28,Комедия,Художественный,Кино,Цветной,0.0,19.0,DVD,Румак Константин Александрович,Россия,2018,К.Румак,Н.Белышева,М.Максим,И.Сахаров,Н.Срывков,К.Румак,16+
345578,Последние шесть дней,2018-11-01,Драма,Художественный,Кино,Цветной,2.0,151.0,HDD,"ООО ""Джей Си Эл Медиа""",Россия,2018,И.Корнеев,,"Ю.Смирнов, И.Корнеев",И.Корнеев,И.Корнеев,Ю.Смирнов,16+
345579,Команда мечты,2019-03-07,"Детский, семейный, спортивный",Художественный,Кино,Цветной,1.0,91.0,Другой,"ООО ""Продюсерский центр ""Молодежные инициативы""",Россия,2018,"М.Зыков, Ф.Абрютин",А.Стрельникова,"И.Купреянова, И.Чечина",М.Дементьев,Е.Загот,"Ф.Абрютин, Д.Якунин, О.Лахно",6+
345580,Галвестон,2018-10-18,Криминальная драма,Художественный,Кино,Цветной,1.0,93.0,HDD,"Джин Думанян Продакшнз, Лоу Спарк Филмз",США,2018,Мелани Лоран,Лиза Майерс,"Ник Пиццолатто, Джим Хамметт",Арно Потье,Марк Шуарен,"Декстер Брафф, Тайлер Дэвидсон, Патрик Дэйли",18+
345581,Закат,2018-10-18,Драма,Художественный,Кино,Цветной,2.0,142.0,HDD,"Лаокун Филмгруп, Плэйтайм, Венгерский национальный кинофонд, Синема дю Монд, Национальный центр кино и анимации, Французский институт, Индэфилмс 6",Венгрия,2018,Ласло Немеш,Ласло Райк,"Ласло Немеш, Клара Ройер, Маттьё Тапонье",Матьяш Эрдей,Ласло Мелиш,"Вигар Бараный, Габор Райна, Габор Шипош",16+
345582,Как прогулять школу с пользой,2018-10-25,Взросление мальчика.,Художественный,Кино,Цветной,1.0,116.0,HDD,"Радар Фильм, Студио Канал, Франс 2 Синема, Сайн Плюс, Франс Телевизьон, Просире, Синема 11 Девелопмент, Плюс Имаж Девелопмент 6, Канал +, Национальный центр кинематографии",Франция,2017,Николя Ванье,Себастьян Бирше,"Николя Ванье, Жерон Тоннер",Эрик Гошар,,"Маттье Вартер, Клеман Мисерез",6+
345583,Хэллоуин,2018-10-18,Фильм ужасов,Художественный,Кино,Цветной,1.0,106.0,HDD,"Блюмхаус Продакшнз, Мирамакс, Руш Хаус Пикчерз, Транкас Интернэшнл Филмз, Юниверсал Пикчерз",США,2018,Дэвид Гордон Грин,Ричард А.Райт,Дэвид Гордон Грин,Майкл Симмондс,Коуди Карпентер,"Малек Аккад, Билл Блок",18+
345584,Смолфут,2018-10-20,Экранизация,Анимационный,Кино,Цветной,1.0,96.0,HDD,"Уорнер Бразерс, Зефтиг Филмз",США,2018,Кэри Киркпатрик,Дэвин Крейн,"Кэри Киркпатрик, Клэр Сера",,Хайтор Перейра,"Джон Рекуа, Бонн Рэдфорд, Гленн Фикарра",6+
345585,Колдовское озеро,2018-11-30,Детектив,Художественный,Кино,Цветной,1.0,94.0,DVD,"ООО ""Телевизионное агентство ""ИРТЫШ"" по заказу ООО ""МАРС МЕДИА ЭНТЕРТЕЙНМЕНТ""",Россия,2018,В.Янковский,Н.Гурьянова,"А.Рулева (псевдоним Анна Рулевская) при участии М.Максимова, Н.Сиривли",И.Пугачев,А.Артишевский,"Р.Дишдишян, ООО ""МАРС МЕДИА ЭНТЕРТЕЙНМЕНТ""",16+
345586,Пришелец,2018-11-08,"Приключения, фантастика, драма. В результате трагических случайностей на Марсе в одиночестве оказывается космонавт. Сколько раз ему придется умереть, чтобы доказать, что он жив...",Художественный,Кино,Цветной,1.0,91.0,HDD,"ООО ""Марсианин""",Россия,2018,А.Куликов,М.Турская,"М.Расходников, О.Расходникова, А.А.Петрухин, А.Куликов, А.Карпов",С.Павлов,"С.Немировский, С.Дудаков, Д.Даньков","ООО ""Марсианин"", АО ""Маринс Групп Интертеймент"", ИП Куликов А.Г., ООО ""Муравей Продакшн""",12+
345587,Крымский мост. Сделано с любовью,2018-10-29,Музыкальная романтическая комедия о любви сейчас и тогда...,Художественный,Кино,Цветной,1.0,102.0,HDD,"ООО ""Студия ""8 рядов""",Россия,2018,Т.Кеосаян,,М.Симоньян,И.Клебанов,С.Трофимов,Д.Кеосаян,12+
345591,Один,2018-10-24,Детектив,Художественный,Кино,Цветной,9.0,590.0,BETACAM–кассета,"ООО ""Объектив""",Россия,2018,"А.Арутюнян, А.Коршунов",Е.Миллер,"Т.Столбова, А.Ларина",В.Брыляков,"М.Кошеваров, А.Маев","И.Юрченко, С.Щеглов",16+
345597,Безупречная жизнь,2018-10-18,Триллер,Художественный,Кино,Цветной,1.0,106.0,HDD,"Фильмографо, Сине Клубе де Аванка",Португалия,2018,Луиш Диого,"Луиш Диого, Эллуа Коррейя",Луиш Диого,Педро Фарате,,"Антонио Коста Валенте, Луиш Диого",16+
345598,Под Сильвер-Лэйк,2018-11-08,Триллер,Художественный,Кино,Цветной,2.0,139.0,HDD,"Вендиан Интертейнмент, Стэй Голд Фьютчес, Гуд Фиэ Филм + Мэнэджмент, Майкл дэ Люка Продакшнз, Пэстел, Салем Стрит Интертейнмент, Бу Пикчерз",США,2018,Дэвид Роберт Митчелл,Майкл Перри,Дэвид Роберт Митчелл,Майкл Джиулакис,Рич Врилэнд,"Крис Бендер, Джейк Вейнер, Майкл Де Лука, Дэвид Роберт Митчелл, Адель Романски",18+
345599,"ПРОКУРОРЫ 4 ""СВИНЦОВАЯ ОТТЕПЕЛЬ 61-ГО. ДЕЛО ВАЛЮТЧИКОВ""",2018-10-13,Документальный фильм,Документальный,Кино,Цветной,0.0,44.0,BETACAM–кассета,"ООО ""Фонд национального кино ""Патриот""",Россия,2018,О.Нарлыев,,"А..Звягинцев, О.Булле",А.Каторженко,,М.Журомская,12+
345600,Маги экрана. Экстрасенсы из телевизора,2018-10-23,Документальный фильм,Документальный,Кино,Цветной,0.0,44.0,BETACAM–кассета,"ООО ""ГОЛД МЕДИУМ""",Россия,2018,В.Белов,,О.Колин,В.Меркулов,В.Романычев,А.Горовацкий,12+
345601,СУПЕРБОБРОВЫ. НАРОДНЫЕ МСТИТЕЛИ,2018-10-20,"Комедия, фантастика",Художественный,Кино,Цветной,1.0,89.0,HDD,"ООО ""Кейстоун продакшн груп"" по заказу АО ""ВБД Груп""",Россия,2018,Д.Дьяченко,Д.Куприн,"А.Казаков, М.Местецкий, Р.Кантор",Д.Грибанов,П.Есенин,"Э.Илоян, В.Шляппо, Д.Жалинский, А.Троцюк",12+
345602,"Прости нас, Юшка!",2018-10-18,Драма,Художественный,Кино,Цветной,0.0,26.0,HDD,"ООО ""Продюсерская компания ""РУСЬ""",Россия,2018,Ю.Горбачевская,П.Харитонова,Ю.Горбачевская,Д.Горбачевский,К.Родионов,,12+
345603,Русский Дунай. Забытая Отечественная война,2019-01-21,Документальный фильм,Документальный,Кино,Цветной,0.0,41.0,Другой,"ООО ""Кинокомпания ""Общественное Мнение""",Россия,2018,П.Ходнев,,А.Быкова,,,,12+
345604,Баба Яга,2018-11-08,Детский анимационный фильм ,Анимационный,Кино,Цветной,1.0,61.0,HDD,"ООО ""Арт Пикчерс Студия""",Россия,2018,В.Саков,Г.Корнышев,"Г.Пуарье, В.Свешников, С.Ушаков",,Ф.Кандинский,"ООО ""Арт Пикчерс Студия"", ООО ""КРИЭЙТИВ АНИМЭЙШН"", ООО ""Система-А""",6+
345605,Зеленый пояс Амура,2018-12-01,Документальный фильм,Документальный,Кино,Цветной,0.0,41.0,BETACAM–кассета,"ООО ""Дальневосточная киностудия""",Россия,2018,А.Самойлов,,А.Самойлов,А.Самойлов,,А.Самойлова,12+
345606,МУЛЬТ в кино. Выпуск № 83,2018-10-27,Анимационный детский сборник,Анимационный,Кино,Цветной,0.0,45.0,HDD,"ООО ""Мульт в кино""",Россия,2018,О.Семёнова,,В.Гизатуллин,,"С.Боголюбский, Д.Ставрович",П.Смирнов,0+
345607,Эпоха Никодима,2018-10-25,Документальный фильм,Документальный,Кино,Цветной,1.0,84.0,BETACAM–кассета,ИП Петросянц Викторина Евгеньевна,Россия,2018,А.Судиловский,,А.Судиловский,,Л.Волкова,В.Петросянц,12+
345608,Как я стал...,2018-08-14,Драма,Художественный,Кино,Цветной,1.0,107.0,Другой,"ООО ""Студия ""КиноПРОБА""",Россия,2018,П.Мирзоев,О.Хлебникова,Я.Пуленович,А.Хамидходжаев,А.Маноцков,Ю.Обухов,16+
345610,"Маша и Медведь. Серия ""Шарики и кубики""""",2018-10-30,,Анимационный,Кино,Цветной,0.0,8.0,HDD,Анимаккорд Лтд,Республика Кипр,2018,Владислав Байрамгулов,Илья Трусов,Олег Кузовков,,Василий Богатырев,"Олег Кузовков, Дмитрий Ловейко, Марина Ратина",0+
345611,Лоро,2018-10-25,Драма,Художественный,Кино,Цветной,2.0,150.0,HDD,"Индиго Филм, Патэ, Франс 2 Синема, Франс Телевизьон ",Италия - Франция,2018,Паоло Соррентино,Стефания Челла,"Умберто Контарелло, Паоло Соррентино",Лука Бигацци,Леле Маркителли,"Никола Джулиано, Карлотта Калори, Франческа Чима",18+
345613,Репродукция,2018-10-25,Триллер,Художественный,Кино,Цветной,1.0,107.0,HDD,"Компани Филмз, Ди Бонавентура Пикчерз, Риверстоун Пикчерз, Ремстар Студиоз, Фундаментал Филмз, Лотос Интертейнмент, Оушн Парк Интертейнмент",США,2018,Джеффри Начманофф,Джонни Бридт,"Чад Ст. Джон, Стивен Хэймел",Чекко Варезе,"Марк Килиан, Пепе Ойеда","Лоренцо Ди Бонавентура, Киану Ривз, Стивен Хэймел",16+
345615,АльфаГо,2018-10-25,Компьютерная игра,Прочее,Кино,Цветной,1.0,90.0,Другой,"Мокси Пикчерз, Рил Эс Дёрт",США,2017,Грег Кос,,Грег Кос,Грег Кос,Фолькер Бертельманн,"Гэри Криг, Кевин Праудфут, Джош Розен",6+
345616,НЕСНОСНЫЕ,2018-10-25,Документальный фильм,Документальный,Кино,Цветной,0.0,26.0,Другой,"ООО ""Кинокомпания ""СНЕГА""",Россия,2018,А.Титов,,А.Титов,"О.Верниченко, М.Белов",,И.Снежинская,12+
345617,УЧИТЕЛЬ ДЛЯ ГЛАЗКА,2018-10-25,Документальный фильм,Документальный,Кино,Цветной,0.0,39.0,Другой,"ООО ""Кинокомпания ""СНЕГА""",Россия,2018,"М.Костарев, Н.Саврас",,Н.Саврас,Н.Аниськин,,И.Снежинская,12+
345622,Техническая эстетика,2018-10-25,О профессии дизайнера в СССР,Документальный,Кино,Цветной,1.0,78.0,BETACAM–кассета,"Фонд ""Возрождение""",Россия,2018,Л.Лысцов,,Л.Лысцов,"А.Игнатов, Д.Шарипов",А.Жемчужников,Т.Хамитова,0+
345624,Кукловод,2018-10-25,Фильм ужасов,Художественный,Кино,Цветной,1.0,89.0,HDD,"Скрин Джемс, Анброукен Пикчерз",США,2018,Куинн Лэшер,Питер Коско,Майк Сканнелл,Эд Вайлд,Нэйтан Уайтхед,"Эдриэнн Биддл, Джек Кэмпбелл",18+
345625,Итигэлов. Смерти нет,2018-10-31,Документальный фильм,Документальный,Кино,Цветной,0.0,46.0,Другой,"ООО ""ОТК""",Россия,2017,А.Линич,,А.Семенова,Мартынш Пунанс,,А.Левин,16+
345634,Богемская рапсодия,2018-10-26,Жизнь Фредди Меркьюри.,Художественный,Кино,Цветной,2.0,135.0,HDD,"Нью Ридженси Пикчерз, Ридженси Интертейнмент, Куин Филмз, Джи Ка Филмз, Трайбека Продакшнз, ХХ век Фокс ",США - Великобритания,2018,Брайан Сингер,Аарон Хэй,"Энтони МакКартен, Питер Морган",Ньютон Томас,Джон Оттмен,"Джим Бич, Грэм Кинг, Роберт Де Ниро",18+
345635,Ужастики 2: Беспокойный Хэллоуин,2018-11-01,Кукла из старой книги наполняет город разной нечистью.,Художественный,Кино,Цветной,1.0,90.0,HDD,"Коламбиа Пикчерз, Ориджинал Филм, Схоластик Интертейнмент, Силвертонг Филмз, Сони Пикчерз Анимейшн",США,2018,Ари Сендел,Расти Смит,"Даррен Лемке, Роб Либер",Барри Петерсон,Доминик Льюис,"Нил Х.Моритц, Дебора Форте",6+
345636,Чужая жизнь,2018-11-01,Триллер,Художественный,Кино,Цветной,1.0,81.0,Другой,"Акционерное общество ""Киностудия ""Ленфильм""",Россия,2018,В.Татарский,С.Зайков,И.Гусева,В.Ревич,А.Лубченко,Э.Пичугин,18+
345646,Остров информатики,2018-10-01,Документальный фильм,Документальный,Кино,Цветной,1.0,61.0,BETACAM–кассета,Наумов Виктор Борисович,Россия,2017,М.Якубсон,,В.Наумов,Г.Поротов,М.Робканов,И.Викторова,6+
345650,Дина. Ру,2018-11-02,Документальный фильм,Документальный,Кино,Цветной,0.0,52.0,BETACAM–кассета,"ООО ""АБ-ТВ продакшн""",Россия,2018,С.Митин,,Э.Митина,С.Амирджанов,В.Свердлов (псевдоним - Владимир Свердлов-Ашкенази),А.Адамская,12+
345651,ДЕВЯНОСТЫЕ,2018-11-20,Фильм о преступности в 90-е годы. ,Художественный,Кино,Цветной,1.0,79.0,HDD,"ООО ""ИДИЛЛИЯ""",Россия,2018,В.Локтионов,В.Локтионов,В.Локтионов,И.Балыкин,,В.Локтионов,18+
345652,Когда не стало Родины моей...,2018-11-01,Документальный фильм,Документальный,Кино,Цветной,0.0,39.0,BETACAM–кассета,"ООО ""Кинохроника""",Россия,2018,Л.Коршик,,Л.Коршик,В.Сачков,,Л.Коршик,18+
345653,Санитар,2018-11-01,Документальный фильм,Документальный,Кино,Цветной,0.0,44.0,BETACAM–кассета,"ООО ""Кинохроника""",Россия,2018,Е.Дубкова,,Е.Дубкова,В.Ламберг,Е.Тарадайкин,Л.Коршик,18+
345664,Холодная война,2018-10-29,Драма,Художественный,Кино,Цветной,1.0,88.0,HDD,"Опус Филм, Эпокалипс Пикчерз, Эм Кей Ти Продакшнз, Арт Франс, Би Фай И Филм Фонд, Канал + Польска, Филм Фо, Протагонист Пикчерз",Польша - Франция - Великобритания,2018,Павел Павликовский,"Бенуа Бару, Марсель Славиньский, Катажина Собанска-Стрзалковска","Петр Борковски, Януш Гловацкий, Павел Павликовский",Лукаш Зал,,"Сильви Барте, Дэниэл Баттсек, Малгозия Бела",18+
345665,Климт и Шиле: Эрос и Психея,2018-10-31,,Прочее,Кино,Цветной,1.0,95.0,HDD,"3D Продуциони, Нексо Диджитал",Италия,2018,Микеле Малли,Микеле Малли,"Микеле Малли, Арианна Марелли","Марко Альфьери, Матеуш Столеки",Кристиан Баканич,"Вероника Ботанелли, Кристина Сарто",18+
345670,МакКуин,2018-11-01,История художника,Прочее,Кино,Цветной,1.0,111.0,HDD,"Мисфитс Интертейнмент, Салон Пикчерз, Командер Филмз, Креайтивити Кэпитал, Мувинг Пикчерз Медиа, Электик Шедоу Компани",Великобритания,2018,"Айан Бонхот, Питер Эттедги",,Питер Эттедги,Уилл Паг,Майкл Найман,"Айан Бонхот, Пол Ван Картер, Эндрю Райдер, Ник Тоссинг",18+
345671,Грецкий орешек,2018-11-08,"Комедия, приключения",Художественный,Кино,Цветной,1.0,90.0,HDD,"ООО ""Синемафор-Финанс"", ООО ""МЕДИАТРЕСТ"", ООО ""РФГ Корп""",Россия,2018,С.Иванов,"В.Жоров, М.Приемко",С.Иванов,М.Абдель-Фаттах,А.Артишевский,"ООО ""Синемафор-Финанс"", ООО ""МЕДИАТРЕСТ"", ООО ""РФГ Корп"", С.Борисов, К.Дронов, А.Робак",16+
345672,Дубликат,2018-11-08,Триллер,Художественный,Кино,Цветной,1.0,101.0,HDD,"Манис Фильм, Рейзд Бай Вульфс",США,2018,Билл Оливер,Лиза Майерс,"Грегори Дэвис, Петер Никовиц, Билл Оливер",Зак Куперштейн,"Брук Блэр, Уилл Блэр","Рэнди Мэниз, Рики Толлман",16+
345673,На край света: В поисках единорога,2018-11-08,Приключения девочки и мальчика в поисках папы.,Анимационный,Кино,Цветной,1.0,92.0,HDD,Тёртл ин Моушн Стьюдиоз,Индия,2017,Камаль Бансаль,"Сухаил Мёрчант, Шриранг Сатхе, Мехул Хирани","Саймон Джуолетт, Сатиджит Рэй",,Тануж Теки,Камаль Бансаль,6+
345674,Проза бродячих псов. Фильм,2018-11-01,Анимэ,Анимационный,Кино,Цветной,1.0,90.0,HDD,Кадокава,Япония,2018,Такуя Игараси,"Юкари Гото, Хироси Канно, Юмико Кондо, Сигэру Нисияма, Арай Нобухиро, Рё Хирата",Кафка Асагири,,Таку Ивасаки,,18+
345675,Бемоль,2018-11-05,Драма,Художественный,Кино,Цветной,1.0,113.0,HDD,"ООО ""Ульбарок""",Россия,2018,С.Миляев,"Ю,Негодаев",С.Миляев,В.Никонов,"В.Ней, А.Андрианов",С.Миляев,18+
345676,Жизнь раз,2018-11-15,Драма,Художественный,Кино,Цветной,1.0,78.0,HDD,"ООО ""Тритона""",Россия,2018,В.Ракша,М.Пасичник-Ракша,В.Ракша,"А.Бурко, София-Злата Шестаковская, В.Ракша","И.Колков, А.Пинская","А.Мансуров, Ю.Троянкин, Д.Лузанов, А.Гадалов",18+
345677,Всё или ничего,2018-11-20,Криминальная комедия,Художественный,Кино,Цветной,1.0,90.0,HDD,"ООО ""ССБ Кино""",Россия,2018,Д.Суворов,М.Алипченко,Д.Суворов,Ю.Никогосов,М.Казанок,"А.Ляхов, А.Калушкин, А.Белов, Д.Суворов",16+
345678,Киноальманах Один,2019-02-15,"Альманах из новел разных авторов разных жанров: драма, мелодрама, черная комедия, трагикомедия, мистический триллер.",Художественный,Кино,Цветной,1.0,91.0,HDD,"ООО ""Кинокомпания Андрея Кончаловского""",Россия,2018,"А.Шабаров, Д.Булин, Н.Михалкова-Кончаловская, Г.Пирогова, Е.Вещева, Т.Федоровская, Е.Абызов","М.Божева, И.Целикова, И.Пономарёв","Е.Абызов, А.Шабаров, А.Молодых, Д.Булин, Н.Михалкова-Кончаловская, И.Вилкова, Д.Кузнецов, Е.Вещева, Е.Киселева, Т.Федоровская","П.Тимофеев, М.Келим, А.Симонов, М.Аркатов, Р.Гурочкин, А.Валенцов, В.Егоров",А.Силаев,"ООО ""Кинокомпания Андрея Кончаловского""",16+
345679,ОЛЕГ БАСИЛАШВИЛИ: МОЁ ТЕАТРАЛЬНОЕ ВРЕМЯ,2018-12-12,Документальный фильм,Документальный,Кино,Цветной,0.0,44.0,Другой,"ООО ""Кинокомпания ""Север""",Россия,2018,В.Потёмкин,,А.Саед-Шах,Ф.Мартынов,В.Розанов,"С.Кармалита, С.Подшивалов",12+
345680,Прощаться не будем,2018-11-06,Военная драма,Художественный,Кино,Цветной,3.0,185.0,HDD,"ООО ""Студия ""МОСТ"", ООО ""РФГ Корп""",Россия,2018,П.Дроздов,П.Шаппо,"П.Дроздов, Н.Лебедева, В.Куликов, А.Петрухин",К.Сперанский,А.Чинцов,А.Петрухин,12+
345681,Москва 1917. Семь дней гражданской войны,2018-11-07,Документальный фильм,Документальный,Кино,Цветной,0.0,52.0,BETACAM–кассета,"ООО ""БАТ продакшн""",Россия,2018,А.Егоров,,А.Егоров,"Д.Протопопов, О.Смольков",Л.Волкова,"Д.Протопопов, К.Якуненков",12+
