344519,Танки,2018-04-26,О пробеге двух опытных образцов танка Т-34 в марте 1940 г.,Художественный,Кино,Цветной,1.0,93.0,DCP,"ЗАО ""МЕДИА-ТРЕСТ""",Россия,2018,К.Дружинин,А.Суворов,А.Назаров,Д.Трифонов,М.Костылев,"Д.Щербанов, О.Антипов",12+
344520,МукА,2018-04-02,Драма,Художественный,Кино,Цветной,,,DPX,Немойтин Михаил Максимович,Россия,2018,М.Немойтин,А.Стрельникова,М.Немойтин,В.Иванов,А.Мкртчян,М.Немойтин,16+
344521,Два хвоста,2018-05-31,Приключения двух зверушек,Анимационный,Кино,Цветной,1.0,75.0,DCP,"ООО ""ЛИЦЕНЗИОННЫЕ БРЕНДЫ""",Россия,2018,"В.Ровенский, Н.Лопато, В.Азеев",Л.Ступенькова,В.Ровенский,Ф.Мезенцев,И.Урюпин,"ООО ""ЛИЦЕНЗИОННЫЕ БРЕНДЫ""",6+
344529,ВМаяковский,2018-04-01,Историческая драма,Художественный,Кино,Цветной,2.0,122.0,DPX,"ООО ""Маяковский""",Россия,2017,А.Шейн,"С.Лукьянов, Г.Агаянц, Е.Митта, Д.Гутов, С.Багс (Иванов)","А.Ваксберг, А.А.Шейн, А.с.Шейн, В.Громов при участии Д.Нейманд и И.Марголина","Й.Грубер при участии А.Костянова, В.Усольцева, Д.Баженова, Б.Литовченко","А.Адасинский, А.Трофим, Д.Курченко","ООО ""Маяковский""",16+
344536,ДВА БИЛЕТА ДОМОЙ,2018-06-01,"Драма  о взаимоотношениях дочери и отца, который ее оставил в раннем детстве.Название фильма ""ПРЕДАННЫЕ"" изменено на"" ДВА БИЛЕТА ДОМОЙ"" на  основание заявления АНО ""КиноДело продакшн"" от 15.05.2018 № 15/05-01-2018  и допсолглашения Минкультуры России от 10.05.2018 № 400-01.1-41/03-18",Художественный,Кино,Цветной,1.0,99.0,DPX,"АНО ""КиноДело продакшн""",Россия,2018,Д.Месхиев,Д.Малич,"М.Ошмянская, С.Гармаш, Д.Месхиев",В.Башта,,"А.Златопольский, Д.Месхиев, С.Гармаш",18+
344537,Леонардо: Миссия Мона Лиза,2018-04-12,"Мультик про Леонардо и его друзей, которые отправляются в путешествие, чтобы найти волшебное сокровище.",Анимационный,Кино,Цветной,1.0,78.0,HDD,"Олл Райтс Энтертеймент, Группо Алкуни",Италия,2018,Серджо Манфио,"Мауро Лавадина, Анна Стинфале, Кристиан Тривелоне","Франческо Манфио, Серджо Манфио, Анна Манфио",,Марко Федальто,Фабио Теста,6+
344538,Славные пташки,2018-04-12,"Мультфильм про птенца и куропатку, которые становятся друг для друга настоящей семьей и проходят немало опасностей вместе.",Анимационный,Кино,Цветной,1.0,83.0,HDD,"Ганхил, Сайборн, Ивес Агеманс","Исландия, Бельгия",2018,Аудни Аусгейрссон,,Фридрик Эрлингсон,,Этли Орварссон,"Хильмар Сигурдссон, Ивес Агеманс",6+
344548,Большой злой лис и другие сказки,2018-04-05,"Анимационная комедия про деревенскую жизнь, которая полна невероятных событий и приключений.",Анимационный,Кино,Цветной,1.0,79.0,HDD,"Фоливари, Паник, Студиоканал","Франция, Бельгия",2017,"Патрик Имбер, Бенжамен Реннер",Бенджамен Реннер,"Бенжамен Реннер, Жан Реньо",,Робер Марсель Лепаж,"Дамиен Брюннер, Дидье Бруннер, Венсан Тавье",6+
344549,"Операция ""Шаровая молния""",2018-04-05,"Триллер, драма. Самолет из Тель-Авива в Париж был захвачен террористами и совершил посадку в Уганде с целью обмена заложников на осужденных преступников. Дипломатически вопрос решить не удалось, поэтому был разработан план спасения.",Художественный,Кино,Цветной,1.0,106.0,HDD,"Партисипант Медиа, Пелликола, Уоркин Тайтл Филмз","Великобритания, США",2018,Жозе Падилья,"Кейв Куинн, Чарло Далли",Грегори Бурк,Лула Карва,Родриго Амаранте,"Тим Беван, Эрик Феллнер",16+
344550,Тихое место,2018-04-07,"Ужасы, триллер, драма. Семья с двумя детьми живет в уединенной ферме в американской глубинке. Дом наполнен монстрами, которые реагируют на любой звук. Герои общаются жестами и должны тихо передвигаться, но дом с детьми не может быть самым тихим местом на земле. ",Художественный,Кино,Цветной,1.0,90.0,Другой,"Платинум Дьюнз, Сандей Найт, Парамаунт Пикчерз",США,2018,Джон Красинский,Джеффри Бикрофт,"Брайан Вудс, Скотт Бек, Джон Красинский",Шарлотта Бруус Кристенсена,Марко Бельтрами,"Майкл Бэй, Эндрю Форма, Брэдли Фуллер",16+
344566,Невероятные приключения Нильса,2018-04-16,Анимационный детский сериал.,Анимационный,Кино,Цветной,4.0,260.0,HDD,"ООО ""АА студио""",Россия,2017,А.Котёночкин,А.Котёночкин,А.Бордзиловский,,Т.Ведерников,"А.Митрошенков, Н.Гюзалян, А.Ованнисян",0+
344569,Республика Z,2018-04-09,Драма об эпидемии.,Художественный,Кино,Цветной,1.0,87.0,HDD,"ООО ""Сайдам Барыл""",Россия,2018,С.Бурнашев,С.Скрябина,А.Амбросьев,М.Кардашевский,"М.Кобяков, Ф.Алексеев",С.Бурнашев,16+
344570,Репетиция,2018-06-01,Фильм о рок-музыкантах.,Художественный,Кино,Цветной,1.0,108.0,Другой,"ООО ""ЛЕДА-ФИЛЬМ""",Россия,2018,Н.Соколов,А.Хашпер,М.Фролов,К.Постников,И.Стариков,"Е.Борисова, А.Остапко",12+
344571,Зачётный препод 3,2018-04-12,"Комедия. Классному руководителю с криминальным прошлым, Зэку Мюллеру, достался класс с трудными подростками. Сумеет ли Зэки помочь ребятам найти мотивацию и вернуть веру в себя?",Художественный,Кино,Цветной,2.0,120.0,HDD,Константин Филм,Германия,2017,Бора Дагтекин,Ева Штиблер,Бора Дагтекин,Маркус Нестрой,"Константин Джоркеф Ширер, Винсент Штайн",Николь Шпрингштуббе,18+
344572,Рэмпейдж,2018-04-12,"Фантастика, приключение. Приматолог Дэвис Окойи пытается предотвратить глобальную катастрофу, спасая Северную Америку от модифицированных хищников. ",Художественный,Кино,Цветной,1.0,107.0,HDD,Ригли Пикчерз; Флинн Пикчер Компани; 7 Бакс Энтертеймент; Эй-Эс-Эй-Пи Энтертеймент,США,2018,Брэд Пейтон,Барри Чусид,"Райан Энгл, Карлтон Кьюз, Райан Дж. Кондал, Адам Щтикель",Яронь Пресан,Эндрю Локингтон,"Бо Флинн, Джон Рикард, Брэд Пейтон, Хирам Гарсиа",16+
344573,Свинья,2018-04-11,"Драма, комедия. В Тегеране погибают модные режиссеры. Режиссера Хасана страшит то, что серийный убийца игнорирует его: неужели он недостаточно  талантлив? Вскоре ситуация разворачивается на 180 градусов - на нарцисса падают подозрения в череде трагедий. ",Художественный,Кино,Цветной,1.0,108.0,HDD,"Дарк Прекёрсор Продакшен, Филмиран, Хедейт Филм",Иран,2018,Мани Хагиги,"Амир Оссейн Годзи, Негар Немати",Мани Хагиги,Махмуд Калари,,Мани Хагиги,18+
344583,Моя бывшая подружка ,2018-04-12,Комедия. Винсент живет со своей подругой Нефели. Правило их дома - никаких серьезных отношений с третьими лицами. Но тут Винсент встречает Джули и нарушает правило. Что на это скажет Нефели? ,Художественный,Кино,Цветной,1.0,85.0,HDD,"ЛЕ ПАКТ, НОРД-УЭСТ ФИЛМС, ЭН-ДЖЕЙ-ДЖЕЙ ЭНТЕРТЕЙНМЕНТ, КАНАЛ +, СИНЕ +, БАНК ПОСТАЛЬ ИМАЖ 10, СИНЕНВЕНТЮР 2, СИНЕМАЖ 11",Франция,2017,Виктор Сейнт Макари,"Оливье Мейдингер, Ариана Дюрант","Тома Кайе, Бенжамин Шарби, Одри Диван",Дэвид Кейлли,,"Пьерр Гайярд, Филипп Боэффард, Ева Мачуэль",18+
344584,Точка невозврата,2018-04-19,"Триллер, драма. Разгар Ливанской войны. На руках у героя погибает жена. Через 10 лет он возвращается в Бейрут, чтобы вызволить из плена давнего друга",Художественный,Кино,Цветной,1.0,109.0,HDD,"Касбах-Филм Тангер, Радар Филмз, ШивГанз Пикчерс",США,2018,Брэд Андерсон,Арад Сават,Тони Гилрой,Бьёрн Чарпентье,Джон Дебни,"Тед Филд, Тони Гилрой, Моника Левинсон",18+
344585,Остров Собак,2018-05-03,"Анимация, приключения, комедия. 12-летний Атари Кобаяши находится под опекой мэра Кобаяши. По указу мэра все домашние собаки изгоняются на свалку. Атари отправляется на мусорный остров, чтобы найти своего пса Спотса. Там начинается его эпичное путешествие вместе с новыми друзьями. ",Анимационный,Кино,Цветной,1.0,101.0,HDD,Фокс Сёрчлайт,"Германия, США",2018,Уэс Андерсон,"Пол Хэррод, Адам Штокхаузен, Курт Эндерле","Уэс Андерсон, Роман Коппола, Кунити Номура",Тристан Оливер,Александр Деспла,"Уэс Андерсон, Джереми Доусон, Стивен Рейлс",16+
344586,Укрась прощальное утро цветами обещания,2018-04-19,"Анимационный фильм, мелодрама. Маккия - из рода бессмертных. Ее город разрушен, она прячется в лесу, где находит маленького мальчика Эриала и начинает заботиться о нем. Через годы у них возникают чувства друг к другу. Но Эриал - человек, а значит, он смертен. Удастся ли им спасти свою любовь?",Анимационный,Кино,Цветной,1.0,115.0,HDD,"Бандай Вижуал, Сигеймс, Хакуходо ДИ мьюзик энд пикчерз, лантис, П.А. Воркс",Япония,2018,"Мари Окада, Тошия Шиохара",,Мари Окада,,Кэндзи Каваи,,12+
344592,Тренер,2018-04-19,Драма о футбольном тренере.,Художественный,Кино,Цветной,2.0,138.0,HDD,"ООО ""ДК интертеймент"", ООО ""Киностудия ""Слово"", ООО ""Студия ""ТРИТЭ"" Никиты Михалкова""",Россия,2018,Д.Козловский,С.Агин,"Д.Козловский, С.Четверухин, А.Золотарев",Ф.Лясс,О.Карпачев,"Д.Козловский, П.Ануров, Л.Верещагин, А.Златопольский, Н.Михалков",12+
344594,МУЛЬТ в кино. Выпуск №73,2018-04-14,Сборник анимационных детских фильмов,Анимационный,Кино,Цветной,0.0,51.0,HDD,"ООО ""Мульт в кино""",Россия,2018,О.Семёнова,,В.Гизатуллин,,"С.Боголюбский, Д.Ставрович",П.Смирнов,0+
344603,Решение о ликвидации,2018-06-07,Боевик об операции ФСБ по уничтожению лидера террористического движения на Северном Кавказе.,Художественный,Кино,Цветной,1.0,96.0,HDD,"ФГУП ""Киноконцерн ""Мосфильм""",Россия,2018,А.Аравин,Ю.Макушина,"А.Бузин при участии П.Павлова, П.Косова",А.Тагиров,Ю.Потеенко,К.Шахназаров,12+
344607,Прощаться не будем,2018-06-21,Военно-исторический детектив из времен октября 1941 года.,Художественный,Кино,Цветной,1.0,115.0,HDD,"ООО ""РФГ Корп"", ООО ""Студия ""МОСТ""",Россия,2017,П.Дроздов,П.Шаппо,"Н.Лебедева, П.Дроздов, В.Куликов, А.Петрухин",К.Сперанский,А.Чинцов,А.Петрухин,6+
344609,Кума,2018-04-19,,Художественный,Кино,Цветной,0.0,14.0,HDD,Кретова Анастасия Валерьевна,Россия,2018,А.Кретова,П.Яновицкий,А.Кретова,А.Федотов,К.Кнерик,"А.Кретова, Г.Голицын",12+
344615,"Вествуд: панк, икона, активист",2018-04-19,Влиятельная личность новейшей истории.,Прочее,Кино,Цветной,1.0,83.0,HDD,"Финишд Филмз, Родар Хауз, Шарп Хауз",Великобритания,2018,Лорна Такер,,,Лорна Такер,Дэн Джонс,"Джон Батсек, Николь Стотт, Элеонора Эмтедж ",18+
344616,Титан,2018-04-19,"Американский военный Рик принимает участие в космической программе. Ученые хотят создают сверхлюдей, чтобы они затем заселили планету Титан. Эксперимент приводит к непредсказуемым последствиям. ",Художественный,Кино,Цветной,1.0,97.0,HDD,"Фор ту Амел Кампани, Зи Моушн Пикче Кэпитал, Ностромо Пикчерз","Великобритания, США, Испания",2018,Леннарт Рафф,Джемма Фаурия,"Макс Харвитц, Араш Амель",Жан-Марчело Кахн,Филь Эйслер,"Араш Амель, Фред Бергер, Леон Клэранс",16+
344617,Привидение ,2018-04-26,Мелодрама. Экранизация литературного произведения.,Художественный,Кино,Цветной,1.0,97.0,HDD,"ФилмВэйв, Лйкли Стори, Метро Голдвин Майер (ЭмДжиЭм), Сильвер Рил, Спай Кидс Фо ЭсПиВи",США,2018,Майкл Сакси,Мэттью Дейвис,"Джесси Эндрюс, Дэвид Левитан",Рогир Стофферс,Эллиотт Вилер,"Энтони Брегман, Питер Крон",16+
344620,Война Анны,2018-06-07,"Драма о трагедии Холокоста, рассказанная через судьбу еврейской девочки Анны.",Художественный,Кино,Цветной,1.0,74.0,HDD,"ООО ""САГа""",Россия,2018,А.Федорченко,А.Максимов,"А.Федорченко, Н.Мещанинова",А.Хамидходжаев,"В.Комаров, Matsumoto Atsuo","А.Савельев, А.Васильев, М.Ложевский",12+
344621,Материя,2018-04-22,Фильм про кино. Кино во сне. Сон про кино. Кино про сон.,Художественный,Кино,Цветной,0.0,26.0,HDD,Озкан Марина Александровна,Россия,2018,"М.Жигалова-Озкан, Ю.Зайцев",Т.Рябушинский,Ю.Зайцев,Т.Лобов,Г.Карданов,М.Озкан,12+
344626,Аниматор,2018-04-29,Мелодраматическая история о человеческих взаимоотношениях. Главная героиня - знаменитая в прошлом актриса.,Художественный,Кино,Цветной,1.0,94.0,DPX," ЗАО ""Кинокомпания ФаворитФильм"" по заказу ООО ""ФАВОРИТ МЕДИА""",Россия,2018,"А.Чижиков, И.Чижиков",Е.Лизогубова,"А.Тимм, А.Чижиков",А.Жабин,М.Чертищев,"А.Чижиков, Н.Чижикова",12+
344627,Я заберу твои деньги,2018-04-19,Хитроумный план бизнесмена.,Художественный,Кино,Цветной,1.0,100.0,HDD,"Рэдиант Филмз Интертейнмент, Сэбан Филмз, Хойлэйк Кэпитал, Энвижн Медиа Артс",США,2017,Лаки МакКи,"Марк Дилло, Марк Хофелинг","Джаред Батлер, Ларс Норберг",Алекса Вендлер,Мэтт Гейтс,"Дэвид Бьюлоу, Ли Нельсон, Дэвид Тиш",18+
344631,МЕЛКИЙ,2018-04-19,"Мелодрама, притча. Под видом Деда Мороза приходит Мелкий Бес...",Художественный,Кино,Цветной,,,DPX,ИП Ганночка С.В.,Россия,2018,"С.Ганночка, С.Крайнев",С.Ганночка,С.Крайнев,А.Близнюк,А.Фоменко,С.Ганночка,18+
344637,Захочу и соскочу. Мастер-класс,2018-06-14,Комедия,Художественный,Кино,Цветной,1.0,119.0,HDD,"Эсент фильм, Фанданго, Эр А И Чинема",Италия,2017,Сидней Сибилиа,,"Валерио Аттаназио, Андреа Гарелло, Сидней Сибилиа",Владан Радович,Анджело Бонанни,"Доменико Прокаччи, Маттео Ровере",16+
344639,Логово монстра,2018-04-19,Тайная жестокость.,Художественный,Кино,Цветной,1.0,110.0,HDD,Электрик Дистрибьюшн,США,2018,Дин Девлин,"Мишель Джонс, Нат Джонс",Брэндон Бойс,Дэвид Коннелл,Джозеф ЛоДука,"Дин Девлин, Рэйчел Олшан",18+
344644,Спитак,2018-04-20,О величайшей катастрофе в Армении - землетрясении 07.12.1988 г.,Художественный,Кино,Цветной,1.0,105.0,DPX,"ООО ""Телесто-фильм"", ФОНД РАЗВИТИЯ НАЦИОНАЛЬНОГО КИНО","Россия, Армения",2018,А.Котт,О.Ухов,М.Гардаш (псевдоним М.Сочинская),П.Духовской,С.Танкян,"Е.Гликман, Т.Варжапетян",16+
344650,Голодные Z,2018-04-26,"Ужасы, драма. В небольшой деревушке неподалеку от Квебека тела местных жителей стали разлагаться, а сами они стали интересоваться свежей плотью.",Художественный,Кино,Цветной,1.0,100.0,HDD,"Ля Мэзон де Продюксьон, Кристал Филмз Дистрибьюшен, Телефильм Канада",Канада,2017,Робин Обер,"Андре-Лине Бопарлан, Филипп Лорд, Джули Чэрленд",Робин Опер,Стив Дерозье,Пьер-Филипп Коте,"Стефани Морисетт, К.С. Рой",18+
344651,Правда или действие ,2018-04-26,"Триллер. Нечто сверхъестественное становится участником игры ""правда или действие"". Кто сможет выйти победителем в жестокой игре? ",Художественный,Кино,Цветной,1.0,100.0,HDD,Блюмхаус продакшнз,США,2018,Джефф Уодлоу,"Мелани Джонс, Алисса Хилл",Джиллиан Джейкобс,Жак Жуффре,Мэттью Марджесон,"Джейсон Блум, Купер Самуэльсон",16+
344652,Великолепная,2018-04-26,"Романтическая комедия. От Анжелы под Рождеством муж уходит из семьи. Что делать? Радоваться вновь обретенной свободе. Ведь жизнь прекрасна, и в ней случаются чудеса...  ",Художественный,Кино,Цветной,1.0,90.0,HDD,"Принсес Бели, Нолита Синема, Ориан, СтудиоКанал, Франс 2 Синема, Синемаж 12, Канал +, Сине+","Франция, Бельгия",2018,Мишель Ларок,Николя Миго,"Мишель Ларок, Лайонел Дутемпл, Бенжамен Морген",Кика Унгаро,,"Максим Делони, Лайонел Дутемпл, Бенжамен Морген",16+
344654,Статус: Обновлен ,2018-05-10,"Комедия, фэнтези. Кайл живет не выпуская из рук телефон. Ему достается новый смартфон с уникальным приложением - любой опубликованный пост воплощается в реальность. Быть в эпицентре мира, как оказалось, не так-то легко... ",Художественный,Кино,Цветной,1.0,106.0,HDD,"Брайтлайт Пикчерс, ДНА Пикчерс, Хейи Кэпитал, Оффспринг Энтертейнмент","Китай, Канада, США",2018,Скотт Спир,Чери Кролл,Джейсон Филарди,Расс Т. Олсобрук,Джефф Кардони,"Дженнифер Гибгот, Доминик Рустам, Адам Шанкман, Шон Уильямсон",16+
344656,Пчёлка Майя и Кубок мёда,2018-05-17,"Комедийная, семейная анимация про Пчелку Майю",Анимационный,Кино,Цветной,1.0,83.0,HDD,"Студия 100 Медиа, Студия Б Анимейшен","Германия, Австралия",2018,"Ноэль Клири, Серджо Делфино, Алекс Стадерманн","Симон Копп, Ральф Нимайер","Ноэль Клири, Фин Эдквист, Кевин Пити, Алекс Стадерманн",,Уте Энгельхардт,"Бенджамин Еу, Трэйси Ленон, Брайн Розен",0+
344657,Музыкальная карта Америки 3D,2018-04-20,Документальное кино. Фильм о музыкальных направлениях в современной Америке,Прочее,Кино,Цветной,,,HDD,МакГилливрэй Фримэн Филмз,США,2018,Грэг МакГилливрэй,,Грэг МакГилливрэй,Брэд Охлунд,Стив Вуд,Шаун МакГилливрэй,6+
