,Название фильма,Дата начала показа фильма,Аннотация,Вид Фильма,Категория,Цвет,"Продолжительность демонстрации, часы","Продолжительность демонстрации, минуты",Формат носителя,Студия-производитель,Страна производства,Год производства,Режиссер,Художник,Сценарист,Оператор,Композитор,Продюсер,Возрастная категория
122447,"Машкины Страшилки. Серия ""Чудовищная правда о том, как страшно быть маленьким""",2017-06-09,Детский сериал,Анимационный,Кино,Цветной,0,6.0,Другой,"ООО Студия ""АНИМАККОРД"" - АНИМАККОРД ЛТД.","Россия, Республика Кипр",2017,Д.Червяцов,И.Трусов,И.Шаров,,А.Друбич,"Д.Ловейко, О.Кузовков",0+
122448,"Машкины Страшилки. Серия ""Чудовищная правда о том, как страшно быть маленьким""",2016-04-25,Детский сериал,Анимационный,Кино,Цветной,0,6.0,Другой,"ООО Студия ""АНИМАККОРД"" - АНИМАККОРД ЛТД.","Россия, Республика Кипр",2017,Д.Червяцов,,И.Шаров,И.Трусов,А.Друбич,"Д.Ловейко, О.Кузовков",0+
123422,Анна Каренина. История Вронского,2016-12-29,"В ролях - Е.Боярская, М.Матвеев, В.Кищенко, К.Гребенщиков  Драма по роману Л.Н.Толстого ""Анна Карелина, публицистической повести  В. Вересаева ""На японской войне и циклу ""Рассказы о японской войне""",,Кино,Цветной,2,138.0,Другой,"ФГУП ""Киноконцерн ""Мосфильм""",Россия,2017,К.Шахназаров,"С.Февралев, Ю.Макушина","А.Бузин, К.Шахназаров",А.Кузнецов,Ю.Потеенко," К.Шахназаров, А.Златопольский",12+
123443,МУЛЬТ в кино. Выпуск № 50,2017-03-21,Мультсборник,Анимационный,Кино,Цветной,0,47.0,Другой,"ООО ""Мульт в кино""",Россия,2017,О.Семёнова,,Гизатуллин В.Р.,,"С.Боголюбский, Д.Ставрович",П.Смирнов,0+
123452,"Анимационный сериал ""Котяткины истории-2""",2017-04-03,Анимационный детский сериал,Анимационный,Кино,Цветной,0,30.0,Другой,"ООО ""Студия ""Мастер-Фильм""",Россия,2017,Д.Наумов,О.Добровольский,Д.Наумов,,Р.Нурмухаметова (Р.Нур),А.Герасимов,0+
123485,Невеста .,2016-10-25,"Ужасы, мистика",,Кино,Цветной,1,95.0,Другой,"ООО ""Форс Медиа""",Россия,2017,С.Подгаевский,А.Фатина,"С.Подгаевский, В.Северцев",И.Бурлаков,Й.Хансен,"В.Северцев, Д.Литвинов, З.Болотаев",16+
123496,Лекарство от здоровья,2017-02-01,"В ролях: Джейсон Айзекс, Дэйн ДеХаан. Оздоровительный центр в швейцарских Альпах.",,Кино,Цветной,2,147.0,Другой,"Ридженси Энтерпрайзис, Нью Ридженси Продакшнз, Блинд Винк Продакшнз, Студио Бабелсберг, Тэ Эс Гэ Интертейнмент",США - Германия,2017,Гор Вербински,Ив Стюарт,"Гор Вербински, Джастин Хэйс",Боян Бацелли,Бенджамин Уоллфисч,"Гор Вербински, Дэвид Крокетт, Арнон Милчан",18+
123497,Босс-Молокосос,2017-02-09,Фантазер.,Анимационный,Кино,Цветной,1,98.0,Другой,ДримУоркс Анимейшн,США,2017,Том МакГрат,,"Майкл МакКаллерс, Марла Фрэйзи",,Ханс Циммер,Рэмси Энн Наито,6+
123500,Живое,2017-03-20,"В ролях: ДЖейк Джилленхолл, Райан Рейнольдс. Жизнь на Марсе. ",,Кино,Цветной,1,110.0,Другой,"Коламбиа Пикчерз, Скайдэнс Медиа, Сони Пикчерз Интертейнмент",США,2017,Даниэль Эспиноса,Найджел Фелпс,"Пол Верник, Рэтт Риз",Шимус МакГарви,Джон Экстренд,"Дана Голдберг, Бонни Кертис, Джули Линн, Дэвид Эллисон",18+
123501,Смурфики: Затерянная деревня,2017-03-20,"В ролях: Ариэль Винтер, Элли Кемпер. Волшебный мир.",,Кино,Цветной,1,93.0,Другой,"Коламбиа Пикчерз, Кернер Интертейнмент Компани, Эл Стар Кэпитал, Сони Пикчерз Анимейшн, Ванда Пикчерз",США,2017,Келли Эсбери,Ноэль Триоро,"Памела Рибон, Стейси Харман",,Кристофер Леннерц,"Мэри Эллен Бодер, Джордан Кернер",6+
123510,Голова. Два уха,2017-05-18,"В ролях - И.Лашин, Т.Лашина, Г.Кокоткин, А.Махлина    Трагикомедия",,Кино,Цветной,1,78.0,Другой,Суслин Виталий Игоревич,Россия,2017,В.Суслин,,"В.Суслин, И.Лашин",А.Малинкович,,,16+
123511,Искупление (2017),2017-05-18,"В ролях - Х.Мустафоев, Т.Заурбекова                         Драма",,Кино,Цветной,,,Другой,Абидова Аниса Сабировна,"Россия, Таджикистан",2017,А.Абидова (псевдоним Аниса Сабири),Т.Муминова,А.Абидова (псевдоним Аниса Сабири),П.Шарифов,,В.Хинензон,12+
123516,Весь этот мир,2017-06-01,"В ролях: Ник Робинсон, Аманда Стенберг. Экранизация.",,Кино,Цветной,1,96.0,Другой,"Итака Филмз, Эллой Интертейнмент, Метро Голдвин Майер, Уорнер Бразерс",США,2017,Стелла Меги,Эйвери Пльюис,Дж.Миллс Гудло,Игор Жадю-Лилло,Людвиг Горанссон,"Элиза Даттон, Лесли Моргенстейн",12+
123533,Осколки,2017-06-07,"В ролях: Ной Хантли, Крис Битем. Драма. Рутина похожих дней",,Кино,Цветной,1,74.0,Другой,"Хайп Филм, Иль Капо Филмз",США,2017,Алиса Хазанова,Катя Щеглова,"Майкл Грегори Куписк, Алиса Хазанова",Федор Лясс,Игорь Вдовин,"Клаудио Белланте, Роман Волобуев, Илья Стюарт, Алиса Хазанова",18+
123534,Песенки для котят Три котёнка,2017-06-16,Мультик на основе английикх детских песенок.,Анимационный,Кино,Цветной,0,29.0,Другой,"ООО ""кинокомпания ""МАСТЕР-ФИЛЬМ""",Россия,2017,"Е.Живайкина, А.Костогарова",О.Добровольский,,,,А.Герасимов,0+
123547,Время первых (2017),2017-02-21,"Фильм-катастрофа. Байопик о космонавте Алексее Леонове, совершившем первый в истории космонавтики выход в открытый космос. В ролях: Е.Миронов, К.Хабенский",,Кино,Цветной,2,142.0,Другой,"ООО ""ТаББаК"", ООО ""Студия Третий Рим""",Россия,2017,Д.Киселев,А.Терехова,"Д.Пинчуков, Ю.Коротков, И.Пивоварова, С.Калужанов, О.Погодин",В.Башта,Ю.Потеенко,"Т.Бекмамбетов, Е.Миронов",6+
123560,Рок,2017-05-05,"Трагикомедия о трех провинциальных музыкантах, отправившихся в Москву по приглашению выступить на радио. В ролях: И.Ивашкин, К.Фролов, Д.Чеботарев, Н.Тарасов, В.Кищенко, Е.Стычкин и др.",,Кино,Цветной,1,87.0,Другой,"ООО ""ВГИК-ДЕБЮТ""",Россия,2017,И.Шахназаров,Н.Васенина,"И.Шахназаров, И.Заваруев",Е.Мусин,Ю.Потеенко,"В.Малышев, Ф.Попов",16+
123566,Выстрел в пустоту,2017-07-13,"В ролях: Джон Бернтал, Николай Костер-Вальдау, Лэйк Белл. Бандитские сферы влияния. ",,Кино,Цветной,2,120.0,Другой,"Болд Филмз, Партисепэнт Медиа, Релативити Студиоз",США,2017,Рик Роман Во,Гай Барнс,Рик Роман Во,Дана Гонсалес,Антонио Пинто,"Джонатан Кинг, Мишель Литвак, Гари Майкл Уотерс",18+
123620,Звонки,2017-02-01,"В ролях: Винсент Д'Офрио, Джонни Галэки. Таинственная видекассета.",,Кино,Цветной,1,102.0,Другой,"Макари/Эдельштейн, Паркес + МакДональд Имэйдж Нэйшн, Вертиго Интертейнмент, Вэддиэйшн Клейртрэп, Коламбиа Пикчерз",США,2017,Ф.Хавьер Гутьеррес,Кевин Кэвэно,"Джейкоб Аарон Эстес, Акива Голдсман, Дэвид Лука, Кодзи Судзуки",Шэрон Мейр,Мэттью Марджесон,"Лори МакДональд, Уолтер Ф.Паркс",18+
123625,МУЛЬТ в кино. Выпуск № 48,2017-03-01,Мультсборник,Анимационный,Кино,Цветной,,,Другой,"ООО ""Мульт в кино""",Россия,2017,О.Семёнова,,Гизатуллин В.Р.,,"С.Боголюбский, Л.Ставрович",П.Смирнов,0+
123669,Собачья жизнь (2017),2017-02-20,"В ролях: Деннис Куэйд, Бритт Робертсон. Экранизация.",,Кино,Цветной,1,100.0,Другой,"Эмблин Интертейнмент, Пэрайа Интертейнмент, Релианс Интертейнмент, Уолден Медиа",США,2017,Лассе Халльстрём,Майкл Карлин,"У. Брюс Кэмерон, Кэтрин Мишон",Терри Стэйси,Рэйчел Портман,"Гэвин Полон, Даррен Риган, Марк Суриан",6+
123670,Матрица времени,2017-02-20,"В ролях: Зои Дойч, Холстон Сейдж. Проклятый день.",,Кино,Цветной,1,100.0,Другой,"Осемнесс Филмз, Джон Шестек Продакшнз",США,2017,Ри Руссо-Янг,Пол Джоял,Мария Мадженти,Майкл Фимоньяри,Адам Тейлор,"Марк Бьенсток, Мэттью Каплан, Брайан Роббинс",16+
123686,Конг: Остров черепа,2017-02-21,"В ролях: Том Хиддлстон, Джон Гудман. Приключения.",,Кино,Цветной,1,118.0,Другой,"Уорнер Бразерс, Леджендари Пикчерз",США - Вьетнам,2017,Джордан Вогг-Робертс,Мэри Вогт,"Макс Боренстейн, Джон Гэйтинс",Ларри Фонг,Генри Джекман,"Джон Джашни, Томас Тулл",16+
123747,Послесвадебный разгром,2017-03-20,"В ролях: Крис Маршалл, Райан Корр. Похождения бедовых друзей-англичан.",,Кино,Цветной,1,92.0,Другой,Гореан Филмз,Австралия,2017,Марк Лампрелл,Эмма Флетчер,Дин Крэйг,Стив Арнольд,Дэвид Хиршфелдер,"Лоуренс Малкин, Шеа Сталлингс, Таня Чэмберс",18+
123748,Голос из камня,2017-05-10,"В ролях: Эмилия Кларк, Мартон Чокаш. Экранизация.",,Кино,Цветной,1,90.0,Другой,"Занук Индепендент, Коуд 39 Филмз, Продюсер Кэпитал Фанд",США - Италия,2017,Эрик Д.Хауэлл,Анна Ломбарди,Эндрю Шоу,Питер Саймонит,Михаэль Вандмахер,"Стефано Галлини-Дуранте, Дин Занук",18+
123752,Не ждали.,2017-06-27,Мелодрама,,Кино,Цветной,1,114.0,Другой,"ЗАО ""Кинокомпания ФаворитФильм""",Россия,2017,В.Мережко,А.Суворов,В.Мережко,И.Багаев,Д.Смирнов,"А.Чижиков, С.Куликов, Н.Чижикова",16+
123764,Крым (2017),2017-04-12,"В ролях - Р.Курцын, Е.Лапова, П.Крайнов, П.Трубинер, Б.Щербаков, Е.Котельникова, Г.Яковлев, А.Комашко, Н.Зверев, И.Буяновер и др.                     Драма, боевик",,Кино,Цветной,1,100.0,Другой,"ООО ""Пиманов и партнеры""",Россия,2017,А.Пиманов,М.Мартьянова,"А.Пиманов, В.Брагин",В.Климов,О.Воляндо,А.Пиманов,16+
123767,Зубы накаливания,2017-04-12,"В ролях - Золототрубова Е., Паньков Р., Панкратов В., Минин Е.                                             Драма, триллер, мистика, ужасы",,Кино,Цветной,,,Другой,Золототрубов Дмитрий Александрович,Россия,2017,Д.Золототрубов,Д.Золототрубов,Д.Золототрубов,Д.Золототрубов,Д.Золототрубов,Д.Золототрубов,16+
123776,Однажды в Германии,2017-05-02,"В ролях: Мориц Бляйбтрой, Ганс Лёв. Американская мечта.",,Кино,Цветной,1,101.0,Другой,"Самса  Филм, Ай Джи Си Филм, Мэтч Фэктори, Антр Шьен э Лу, Цвейте Дойче Фернштейн, Центр дю Синема э де лаудивизуэль де ля Федерасьон Валони Брюсель",Германия - Люксембург - Бельгия,2017,Сэм Гарбарски,"Артур Депре, Вероника Сакре","Майкл Бергманн, Сэм Гарбарски",Вирджини Сен-Мартен,Рено Гарсиа Фонс,"Себастьен Деллуа, Рошанак Берешт Неджад, Джани Тилтгес",16+
123779,Трио в перьях,2017-04-21,Приключения воробья.,Анимационный,Кино,Цветной,1,84.0,Другой,"Надсен и Стрюбер Медиенмануфактур, Улисс Фильмпродакшн, Уолкинг Зе Дог, Мелюсин Продакшнз, Ден Сист Скиллинг",Германия - Бельгия - Люксембург - Норвегия,2017,"Тоби Генкель, Реза Мемари",Стефан Лекок,Реза Мемари,,Эрик Невё,Кристин Надсен,6+
123780,Одарённая,2017-04-27,"В ролях: Крис Эванс, Дженни Слейт. Дядя и племянница.  ",,Кино,Цветной,1,102.0,Другой,"ХХ век Фокс, Фокс Сёрчлайт Пикчерз",США,2017,Марк Уэбб,Лаура Фокс,Том Флинн,Стюарт Драйбёрг,Роб Симонсен,"Энди Коэн, Карен Ландер",12+
123781,Чужой: Завет,2017-04-27,"В ролях: Майкл Фассбендер, Джеймс Франко. Новый фильм франшизы.",,Кино,Цветной,2,123.0,Другой,"ХХ век Фокс, Брэндивайн Продакшнз, Скотт Фри Продакшнз, Тэ Эс Гэ Продакшнз",США - Австралия - Новая Зеландия - Великобритания,2017,Ридли Скотт,Крис Сигерс,"Джон Логан, Джек Паглен, Данте Харпер",Дариуш Вольски,Джед Курзель,"Ридли Скотт, Марк Хаффам, Майкл Шефер",18+
123796,Яна + Янко,2017-01-20,Семейная мелодрама,,Кино,Цветной,1,95.0,Другой,"ООО ""Магнум-фильм""",Россия,2017,Н.Меркулова,У.Рябова,"Н.Меркулова, А.Чупов, Е.Бирг",О.Кириченко,"А.Шварц, К.Шарафутдинов, Д.Чижевский",А.Семенов,12+
123797,Логан: Росомаха,2017-02-01,"В ролях: Хью Джекман, Патрик Стюарт. Смерть злодеям.",,Кино,Цветной,2,135.0,Другой,"Доннерс Компани, Марвел Интертейнмент, Тэ Эс Гэ Интертейнмент, ХХ век Фокс",США,2017,Джеймс Мэнголд,Франсуа Одуи,"Майкл Грин, Джеймс Мэнголд, Скотт Фрэнк",Джон Мэтисон,Марко Белтрами,"Саймон Кинберг, Хатч Паркер, Лорен Шулер Доннер",18+
123802,Любовь и Сакс,2017-02-16,Ироничная мелодрама,,Кино,Цветной,1,106.0,Другой,"ООО ""ДжемСтудия""",Россия,2017,А.Сурикова,К.Мельников,А.Сурикова,Г.Беленький,,А.Голутва,12+
123809,Бабич,2017-04-13,"В ролях - И.Тагиров, Р.Сальманов                              Исторический, драма, поэтикал",,Кино,Черно-белый,1,97.0,Другой,"ООО ""Живая Лента""",Россия,2017,Б.Юсупов,Р.Баймухаметов,"Т.Бабичева, Г.Саламатова",Д.Гайткулов,Р.Сагитов,"Б.Юсупов, Л.Филинов",6+
123813,Орбита 9,2017-06-05,"Научная фантастика  о космосе. В ролях: Клара Лаго, Алекс Гонзалес.",,Кино,Цветной,1,95.0,Другой,"Кактус Флауэр, Динамо, Моно Фильм, Телефоника Студиос",Испания-Колумбия,2017,Хатем Храиче,"Иниго Наварро, Мария Фернанда Муньос, Сайоа Лара, Мария Андреа Рангель",Хатем Храиче,Пау Эстеве Бирба,Федерико Хусид,"Кристиан Конти, Мигель Менендес де Зубиллага",16+
123816,Трансформеры: Последний рыцарь,2017-06-16,"В ролях: Марк Уолберг, сэр Энтони Хопкинс, Стэнли Туччи. ",,Кино,Цветной,2,149.0,Другой,"Ди Бонавентура Пикчерз, Ха��бро, Уауа Медиа, Йен Брайс Продакшнз, Парамаунт Пикчерз, Том ДэСанто / Дон Мёрфи Продакшнз ",США,2017,Майкл Бэй,Джеффри Бикрофт,"Артур Маркам, Кен Нолан, Мэтт Холлоуэй",Джонатан Села,Стив Яблонски,"Лоренцо Ди Бонавентура, Йен Брайс, Дон Мерфи, Том ДеСанто",12+
123820,ТЕСНОТА,2017-05-23,Драма,,Кино,Цветной,1,118.0,DCP,"Некоммерческий фонд поддержки кинематографа ""Примеринтонации (Фонд Александра Сокурова)""",Россия,2017,К.Балагов,А.Падерин,"А.Ярыгин (псевдоним А.Яруш), К.Балагов",А.Емельянов,,Н.Янкин,18+
123849,Одноклассницы: Новый поворот,2017-01-27,"Комедия. Даша находит судьбу в лице банковского работника. Но все не бывает гладко... В ролях: С.Ходченкова, Е.Вилкова, В.Мазунина",,Кино,Цветной,1,76.0,Другой,"ООО ""КиноФирма""",Россия,2017,Д.Суворов,П.Гаврилова,В.Ровенский,Ю.Никогосов,,"К.Елкин, В.Ровенский, М.Рогальский, А.Руже",16+
123881,Безумные соседи,2017-06-29,"В ролях: Кристиан Клавье, Ари Абиттан. Буржуазные ценности.",,Кино,Цветной,1,92.0,Другой,"Камера Уан, Уй Продюксьон, Пульсар Продюксьон, Эс Эн Дэ Фильм, Нексус Фэктори, Умедиа, Эм 6 Фильм, Канал +, Сине +, УФонд, Ля Валони ",Франция - Бельгия,2017,Филипп де Шоврон,,"Гай Лоран, Марк де Шоврон",Филипп Жильбер,Эрве Ракотофиринга,"Кристиан Клавье, Патрис Леду",16+
123919,Форсаж 8,2017-04-03,"В ролях: Вин Дизель, Шарлиз Терон. Гонка продолжается.",,Кино,Цветной,2,138.0,Другой,"Итака Филмз, Уан Рейс Филмз, Ориджинал Фильм",США,2017,Ф.Гэри Грей,Билл Брзески,"Крис Морган, Гэри Скотт Томпсон",Стивен Ф.Уиндон,Брайан Тайлер,"Вин Дизель, Нил Х.Мориц, Майкл Фоттрел",12+
123971,Уйти красиво,2017-03-23,"В ролях: Морган Фриман, Алан Аркин. Комедия о старости.",,Кино,Цветной,1,96.0,Другой,"Уорнер Бразерс, Нью Лайн Синема, Де Лайн Пикчерз, Метро Голдвин Майер, Виллидж Роадшоу Пикчерз",США,2017,Зак Брафф,Энн Джонс,Теодор Мелфи,Родни Чартерс,Роб Симонсен,"Дональд Де Лайн, Тони Билл, Джонатан МакКой",18+
123975,Частное пионерское - 3,2017-04-07,"В ролях - С.Трескунов, А.Вистингаузен, Е.Клинаев, О.Блинов, М.Иванов, Д.Руденок, М.Лисовая и др.              Подрасковая комедия, приключения",,Кино,Цветной,1,99.0,Другой,"ООО ""Кинопрограмма  ""XXI век""",Россия,2017,А.Карпиловский,У.Рябова,"О.Сироткин, А.Максименко при участии А.Карпиловского",М.Милашин,"М.Кошеваров, С.Зыков","В.Есинов, Ю.Рязанов",12+
123984,Нелюбовь,2017-05-19,"В ролях - М.Спивак, А.Розин, М.Новиков, А.Фатеев, М.Васильева, А.Кейш, Н.Потапова, С.Борисов          Драма",,Кино,Цветной,2,127.0,Другой,"ООО ""Нон-Стоп Продакшн"", ООО ""Фетисов Иллюзион"", Компания ""Уай нот продакшнс"" (WHY NOT PRODUCTIONS), Компания ""Сенатор филм продакшн ГМБХ"" (SENATOR FILM PRODUKTION GMBH), Компания ""Ле фильм дю флёв"" (LES FILMS DU FLEUVE)","Россия, Франция, Германия, Бельгия",2017,А.Звягинцев,А.Понкратов,"О.Негин, А.Звягинцев",М.Кричман R.G.C.,"Е.Гальперин, А.Гальперин","А.Роднянский, С.Мелькумов, Г.Фетисов",18+
123987,Как Витька Чеснок вёз Лёху штыря в дом инвалидов,2017-06-30,"В ролях - Е.Ткачук, А.Серебряков Драма",,Кино,Цветной,1,90.0,Другой,"ООО ""Продюсерский центр ""ВГИК - Дебют""",Россия,2017,А.Хант,А.Давыдова,А.Бородачёв,Д.Фомичёв,,"В.Мадышев, Ф.Попов",18+
